{
  "schemaVersion": "strategy-flow-input/0.2",
  "strategy": {
    "strategyName": "通用客群激活策略",
    "strategyId": "WB-CONTRACT-020-001",
    "paradigm": "customer",
    "owner": "张三",
    "submitter": "李四",
    "version": "0.1",
    "versionStatus": "draft"
  },
  "taxonomy": {
    "schemaVersion": "strategy-taxonomy/2026-09",
    "tagSelections": [
      {
        "fieldCode": "lifecycle",
        "values": [{ "code": "existing", "label": "存量" }]
      },
      {
        "fieldCode": "customerClass",
        "values": [{ "code": "generic", "label": "通用客群" }]
      },
      {
        "fieldCode": "assetRange",
        "values": [
          {
            "code": "unlimited",
            "parentCode": "generic",
            "label": "不限资产"
          }
        ]
      },
      {
        "fieldCode": "riskLevel",
        "values": [
          { "code": "unspecified", "label": "不设分风险等级" }
        ]
      },
      {
        "fieldCode": "businessScene",
        "values": [{ "code": "user_activation", "label": "用户激活" }]
      },
      {
        "fieldCode": "strategyType",
        "values": [
          {
            "code": "tail_customer_operation",
            "parentCode": "user_activation",
            "label": "长尾客户运营策略"
          }
        ]
      },
      {
        "fieldCode": "touchScene",
        "values": [{ "code": "app", "label": "APP触达" }]
      },
      {
        "fieldCode": "touchMethod",
        "values": [
          {
            "code": "in_app_message",
            "parentCode": "app",
            "label": "站内信"
          }
        ]
      }
    ],
    "freeTextTags": [
      {
        "fieldCode": "strategySubtype",
        "value": "通用客群激活策略"
      }
    ],
    "customTagProposals": []
  },
  "nodes": [
    {
      "localId": "n1",
      "nodeType": "entry",
      "time": "启动日",
      "executor": "系统",
      "subject": { "type": "customer", "name": "通用目标客群", "state": "未触达" },
      "displayName": "系统·客群未触达",
      "layout": { "x": 80, "y": 160 }
    },
    {
      "localId": "n2",
      "nodeType": "process",
      "time": "启动后1日",
      "executor": "系统",
      "subject": { "type": "customer", "name": "通用目标客群", "state": "已触达" },
      "displayName": "系统·客群已触达",
      "layout": { "x": 430, "y": 160 }
    },
    {
      "localId": "n3",
      "nodeType": "outcome",
      "time": "观察期结束前",
      "executor": "责任执行人",
      "subject": { "type": "customer", "name": "通用目标客群", "state": "已转化" },
      "displayName": "责任人·客群已转化",
      "layout": { "x": 790, "y": 160 }
    }
  ],
  "edges": [
    {
      "localId": "e1",
      "from": "n1",
      "to": "n2",
      "edgeType": "state_transition",
      "actorBehavior": {
        "time": "启动日",
        "action": "多渠道触达",
        "status": "executed"
      },
      "subjectBehavior": {
        "time": "启动日",
        "action": "点击链接",
        "status": "happened"
      },
      "confirmed": true,
      "mutexGroup": "g1",
      "overwriteSource": false,
      "label": "点击后进入已触达"
    },
    {
      "localId": "e2",
      "from": "n2",
      "to": "n3",
      "edgeType": "handoff",
      "actorBehavior": {
        "time": "观察期结束前",
        "action": "人工跟进",
        "status": "executed"
      },
      "subjectBehavior": {
        "time": "观察期结束前",
        "action": "完成转化",
        "status": "happened"
      },
      "confirmed": true,
      "mutexGroup": "g2",
      "overwriteSource": false,
      "label": "跟进并完成转化"
    }
  ],
  "strategyActions": [
    {
      "localId": "sa1",
      "nodeId": "n1",
      "outgoingEdgeId": "e1",
      "time": "启动日",
      "subjectState": "未触达",
      "judge": "无前置判断（流程入口）",
      "touchScene": "多渠道触达",
      "touchMethod": "按实际渠道填写",
      "theme": "引导完成关键行为",
      "goal": "引导完成关键行为",
      "hook": "通用权益",
      "copy": "【通用示例文案】请按实际策略替换。",
      "hasLink": true,
      "metrics": ["触达数", "点击数", "点击率"]
    }
  ],
  "processActions": [
    {
      "localId": "pa1",
      "nodeId": "n2",
      "outgoingEdgeId": "",
      "executor": "系统",
      "scene": "按实际场景填写",
      "condition": "客户已触达且需要人工跟进",
      "result": "线索转交责任执行人",
      "action": "转交线索给责任执行人",
      "hook": "待确认",
      "recipient": "责任执行人",
      "metrics": ["任务数"]
    }
  ]
}
